{
  "schema_version": "2.0",
  "run_id": "example-run-001",
  "big_task_id": "TASK-A",
  "phase_id": "TASK-A-P01",
  "phase_kind": "implementation",
  "objective": "Implement the first bounded consumer on the already approved interface.",
  "write_capable": true,
  "prompt_file": "/home/khoa/.local/state/mlgo-cao/runs/example-run-001/v2/packets/TASK-A-P01-prompt.md",
  "routing_proposal_file": "/home/khoa/.local/state/mlgo-cao/runs/example-run-001/v2/packets/TASK-A-P01-routing.json",
  "worktree": {
    "path": "/home/khoa/Projects/.mlgo-worktrees/melbourne-local-growth-ops/task-a-p01",
    "branch": "agent/task-a-p01",
    "base_ref": "integration/example-run-001",
    "create_if_missing": true,
    "require_clean": true
  },
  "ownership": {
    "allowed_paths": ["packages/example/src", "packages/example/tests"],
    "forbidden_paths": [".github", "ops"]
  },
  "evidence_directory": "/home/khoa/.local/state/mlgo-cao/runs/example-run-001/evidence/TASK-A-P01",
  "validation": {
    "commands": ["pnpm --filter example test", "pnpm --filter example typecheck"],
    "timeout_seconds": 1800,
    "reuse_evidence_for_sha": true
  },
  "result_contract": {
    "allowed_statuses": [
      "READY_FOR_COMMIT",
      "PLAN_CONFLICT",
      "CAPABILITY_ESCALATION_REQUIRED",
      "ENVIRONMENT_BLOCKED",
      "MISSING_REQUIRED_CONTEXT"
    ]
  },
  "review": {
    "required": true,
    "phase_packet_file": "/home/khoa/.local/state/mlgo-cao/runs/example-run-001/v2/packets/TASK-A-P01-REVIEW-template.json"
  },
  "integration": {
    "enabled": true,
    "integration_worktree": "/home/khoa/Projects/.mlgo-worktrees/melbourne-local-growth-ops/example-run-001-integration",
    "integration_branch": "integration/example-run-001"
  },
  "task_lead": {
    "task_lead_id": "TASK-A-LEAD",
    "terminal_id": null
  },
  "stop_conditions": [
    "Stop when the owned behavior and requested tests pass.",
    "Stop and escalate before changing a shared interface or forbidden path."
  ],
  "rollback_boundary": "Revert the exact task commit before it is integrated.",
  "parent_phase_id": null
}
